Grade,Subject,Sub-Domain,Learning Outcome,Indicator
Grade 9,Science,Life Sciences,"9-5-1-1-1 Understanding that the cell is the basic building unit of living organisms, knowing some of the technologies that helped study them, and comparing single-celled and multi-cellular organisms.",4. Describing the vital activities and processes of the cell that are necessary for the continuation of life in living organisms
Grade 9,Science,Life Sciences,9-5-1-1-2 Describing the main events in the stages of the cell cycle and comparing between mitosis and meiosis.,"2. Explaining the importance of interphase and cell division, describing the condition of cells during these stages, and distinguishing them from active cells."
Grade 9,Science,Life Sciences,9-5-1-1-2 Describing the main events in the stages of the cell cycle and comparing between mitosis and meiosis.,3. Defining mitosis and identifying its successive phases and the changes that occur in the cell during each phase.
Grade 9,Science,Life Sciences,9-5-1-1-2 Describing the main events in the stages of the cell cycle and comparing between mitosis and meiosis.,"5. Comparing mitosis and meiosis in terms of importance, stages, outcomes, and the types of cells in which each division occurs."
Grade 9,Science,Life Sciences,9-5-1-1-3 Understanding the importance of integration of human body systems and how the structure of different organ relate to one another to maintain homeostasis and body health.,2. Explaining how the systems interact and integrate in maintaining homeostasis health and safety of the body's balance.
Grade 9,Science,Life Sciences,9-5-1-1-3 Understanding the importance of integration of human body systems and how the structure of different organ relate to one another to maintain homeostasis and body health.,3. Predicting diseases resulting from a malfunction in the functioning of organs and systems in the human body and suggesting ways of prevention.
Grade 9,Science,Life Sciences,"9-5-1-3-1 Explaining the impact of changes in biodiversity on the environment and humans at both local and global levels, and describing how the ability of species to adapt to diverse environmental conditions affects biodiversity.",1. inferring the impact of biodiversity on species survival and the sustainability of ecosystems.
Grade 9,Science,Life Sciences,"9-5-1-3-1 Explaining the impact of changes in biodiversity on the environment and humans at both local and global levels, and describing how the ability of species to adapt to diverse environmental conditions affects biodiversity.",2. Explaining the impact of species’ ability to adapt to diverse environmental conditions on biodiversity in different ecosystems.
Grade 9,Science,Life Sciences,"9-5-1-3-1 Explaining the impact of changes in biodiversity on the environment and humans at both local and global levels, and describing how the ability of species to adapt to diverse environmental conditions affects biodiversity.","3. inferring the consequences of the extinction of certain species of living organisms and its impact on biodiversity in the Kingdom of Saudi Arabia, proposes possible solutions to address a problem that threatens biodiversity in the local environment, and explains the national efforts made to reduce the extinction of endangered species ."
Grade 9,Science,Life Sciences,9-5-1-3-2 Explaining the impact of extinction on biodiversity and describing the changes that have occurred in biodiversity throughout the history of life,"1. Organizing data on the appearance of specific fossilized organisms (fossils) in the fossil record as a function of time, determined by their position in sedimentary layers or by rock ages."
Grade 9,Science,Life Sciences,9-5-1-3-2 Explaining the impact of extinction on biodiversity and describing the changes that have occurred in biodiversity throughout the history of life,2. Analyzing data using graphs and maps to provide evidence illustrating the changes that have occurred in living organisms throughout the history of life on Earth.
Grade 9,Science,Life Sciences,"9-5-1-3-3 Explaining how matter and energy are transferred within an ecosystem, predicting the changes resulting from the extinction of one of its components, describing material cycles in the ecosystem, and inferring their role in supporting its sustainability.","2. Describing material cycles (water, carbon dioxide, and nitrogen) in an ecosystem and their transfer through biotic and abiotic components, and inferring their role in supporting sustainability."
Grade 9,Science,Life Sciences,9-5-1-3-4 Describing types of aquatic and terrestrial ecosystems and the interactive relationships among their components.,"1. Describing aquatic and terrestrial ecosystems, identifying the characteristics of the biological populations that live within them, and explaining how they interact together to form a biological community."
Grade 9,Science,Life Sciences,9-5-1-3-4 Describing types of aquatic and terrestrial ecosystems and the interactive relationships among their components.,"1. Identifying the characteristics of a balanced ecosystem based on the availability of factors that maintain its balance (availability of clean water, recycling of nutrients, prevention of soil erosion, and diversity of living organisms)."
Grade 9,Science,Life Sciences,9-5-1-3-4 Describing types of aquatic and terrestrial ecosystems and the interactive relationships among their components.,"2. Describing the interactive relationships among living organisms in ecosystems (competition, predation, mutualism, and parasitism)."
Grade 9,Science,Life Sciences,"9-5-1-3-5 Identifying the characteristics of a balanced ecosystem, analyzing the factors and variables that affect its balance, explaining the impact of human activities on it, predicting the consequences of its imbalance, and evaluating designed solutions to address local environmental problems and restore its balance.","2. Distinguishing between human and natural factors that affect ecosystem balance, and predicting the effects resulting from changes in one component of the ecosystem on the living organisms that inhabit it."
Grade 9,Science,Life Sciences,"9-5-1-3-5 Identifying the characteristics of a balanced ecosystem, analyzing the factors and variables that affect its balance, explaining the impact of human activities on it, predicting the consequences of its imbalance, and evaluating designed solutions to address local environmental problems and restore its balance.",3. Analyzing data to identify the factors and variables that affect the efficiency of ecosystems.
Grade 9,Science,Life Sciences,"9-5-1-3-6 Describing the concept of biomass and its sources, and identifying its importance in biofuel production and reducing carbon emissions.",1. Explaining the concept of biomass and identifying its sources.
Grade 9,Science,Life Sciences,"9-5-1-3-6 Describing the concept of biomass and its sources, and identifying its importance in biofuel production and reducing carbon emissions.",2. Describing the concept of biofuel and inferring its advantages and limitations.